"id","name","gender","role","description","is_favorite","user_id","is_global","created_at","updated_at"
"034542ff-d9bb-4dd8-8217-c71fc03da004","Elena, Warrior Princess","Female","Warrior","A fierce warrior princess with flowing red hair, emerald eyes, and ornate armor","true",,"false","""2025-09-19T18:02:33.911Z""","""2025-09-19T18:02:33.911Z"""
"19d6717e-18ec-4343-9729-82e21f43a0e5","Marcus, Knight Commander","Male","Knight","A noble knight commander in gleaming silver armor with a scarred face and determined expression","true",,"false","""2025-09-19T18:02:33.911Z""","""2025-09-19T18:02:33.911Z"""
"495e1fb2-eb57-4ec6-bde3-43a6644f70cd","Zara, Mystic Scholar","Female","Mage","An elegant mystic scholar with dark skin, white hair, and glowing tattoos","false",,"false","""2025-09-19T18:02:33.911Z""","""2025-09-19T18:02:33.911Z"""
"50122acc-4900-4047-8b22-63268d2e8dae","Luna, Forest Guardian","Female","Nature Spirit","An ethereal forest guardian with antlers, flowing green robes, and nature magic","false",,"false","""2025-09-19T18:02:33.911Z""","""2025-09-19T18:02:33.911Z"""
"d4b2bd9c-a991-441e-a572-6b24aaea44cc","Kai, Street Samurai","Non-binary","Cyberpunk","A cyberpunk street samurai with neon implants, leather jacket, and katana","false",,"false","""2025-09-19T18:02:33.911Z""","""2025-09-19T18:02:33.911Z"""